publicationYear,title,isPartOf,docType,issueNumber,volumeNumber,creator
2006,Movements and Memory: The Making of the Stonewall Myth,American Sociological Review,article,5,71,Suzanna M. Crage; Elizabeth A. Armstrong
1962,Public Affairs Opinion Leadership Among Educational Television Viewers,American Sociological Review,article,6,27,"Roy E. Carter, Jr.; Peter Clarke"
2006,"Reply to Lee, ASR, February 2006: Is There No Place for Culture in a Sociology of Legal and Illegal Enterprise?",American Sociological Review,article,1,71,Jeffery T. Ulmer; Darrell Steffensmeier
2006,Scar Effects of Unemployment: An Assessment of Institutional Complementarities,American Sociological Review,article,6,71,Markus Gangl
2001,"Social Movements and Policy Implementation: The Mississippi Civil Rights Movement and the War on Poverty, 1965 to 1971",American Sociological Review,article,1,66,Kenneth T. Andrews
2014,“Notable” or “Not Able”,American Sociological Review,article,2,79,Stoyan V. Sgourev; Niek Althuizen
2007,Dynamics of Political Polarization,American Sociological Review,article,5,72,Peter Bearman; Delia Baldassarri
1989,"Durkheim, Suicide, and Religion: Toward a Network Theory of Suicide",American Sociological Review,article,1,54,Bernice A. Pescosolido; Sharon Georgianna
2016,Ripples of Fear,American Sociological Review,article,2,81,Ji-Yub (Jay) Kim; Daphne Teh; Henrich R. Greve
2004,What is Originality in the Humanities and the Social Sciences?,American Sociological Review,article,2,69,Grégoire Mallard; Joshua Guetzkow; Michèle Lamont
1963,"High School Social Status, College Plans, and Interest in Academic Achievement: A Panel Analysis",American Sociological Review,article,6,28,Edward L. McDill; James Coleman
1991,Air Passenger Linkages and Employment Growth in U.S. Metropolitan Areas,American Sociological Review,article,4,56,Michael D. Irwin; John D. Kasarda
1978,On the Interaction Between a Movement and Its Environment,American Sociological Review,article,1,43,Edward J. Walsh
1999,The Structuring of Organizational Populations,American Sociological Review,article,3,64,David N. Barron
1984,"School Grades and Responsibility for Younger Siblings: An Empirical Study of the ""Teaching Function""",American Sociological Review,article,2,49,Thomas Ewin Smith
2011,Cultural Anchors and the Organization of Differences,American Sociological Review,article,2,76,Amin Ghaziani; Delia Baldassarri
1995,"When Bigger Is Not Better: Family Size, Parental Resources, and Children's Educational Performance",American Sociological Review,article,5,60,Douglas B. Downey
1937,The Logico-Meaningful Method of P. A. Sorokin,American Sociological Review,article,6,2,Robert Bierstedt
1999,"Parental Networks, Social Closure, and Mathematics Learning: A Test of Coleman's Social Capital Explanation of School Effects",American Sociological Review,article,5,64,Stephen L. Morgan; Aage B. Sørensen
1970,The Forum Theory of Organizational Democracy: Structural Guarantees as Time-Related Variables,American Sociological Review,article,1,35,John G. Craig; Edward Gross
1962,Asymmetric Causal Models: Comments on Polk and Blalock,American Sociological Review,article,4,27,W. S. Robinson
2019,The Cognitive Dimension of Household Labor,American Sociological Review,article,4,84,Allison Daminger
2016,How Parents Fare: Mothers' and Fathers' Subjective Well-Being in Time with Children,American Sociological Review,article,5,81,Kelly Musick; Ann Meier; Sarah Flood
1982,"Achievement Variables and Class Cultures: Family, Schooling, Job, and Forty-Nine Dependent Variables in the Cumulative GSS",American Sociological Review,article,5,47,James A. Davis
1997,Citizenship and Public Schools: Accounting for Racial Inequality in Education in the Pre- and Post-Disfranchisement South,American Sociological Review,article,1,62,Pamela Barnhouse Walters; David R. James; Holly J. McCammon
2020,"Who Gets the Benefit of the Doubt? Performance Evaluations, Medical Errors, and the Production of Gender Inequality in Emergency Medical Education",American Sociological Review,article,2,85,Arjun Dayal; Daniel M. O’Connor; Alexandra Brewer; Melissa Osborne; Vineet M. Arora; Anna S. Mueller
1999,Comment on Zhou & Hou: A Negative Life Event with Positive Consequences?,American Sociological Review,article,1,64,Kevin Chen; Xiaonong Cheng
1982,Re-Blaming the Victim: Reply,American Sociological Review,article,4,47,Diana B. Dutton
1986,The Impact of Industrial and Occupational Structure on Black-White Employment Allocation,American Sociological Review,article,3,51,Robert L. Kaufman
2018,"Scents and Sensibility: Olfaction, Sense-Making, and Meaning Attribution",American Sociological Review,article,2,83,Karen A. Cerulo
2014,Protest on the Fly: Toward a Theory of Spontaneity in the Dynamics of Protest and Social Movements,American Sociological Review,article,6,79,Dana M. Moss; David A. Snow
1995,What's in a Name? Sociological Explanation and the Problem of Place,American Sociological Review,article,5,60,Margaret R. Somers
2009,Models and Marginals: Using Survey Evidence to Study Social Networks,American Sociological Review,article,4,74,Lynn Smith-Lovin; Matthew E. Brashears; Miller McPherson
1953,Role Conflict and Ambivalence in Leadership,American Sociological Review,article,4,18,Melvin Seeman
2008,The Social Production of Toxic Uncertainty,American Sociological Review,article,3,73,Javier Auyero; Debora Swistun
1943,Attitudes on State University Campuses,American Sociological Review,article,6,8,Jay C. Knode
2010,Latino Immigrants and the U.S. Racial Order: How and Where Do They Fit In?,American Sociological Review,article,3,75,Reanne Frank; Ilana Redstone Akresh; Bo Lu
1981,The Myth of Social Class and Criminality Reconsidered,American Sociological Review,article,1,46,John Braithwaite
2015,Us and Them: Black-White Relations in the Wake of Hispanic Population Growth,American Sociological Review,article,4,80,Maria Abascal
2012,Globalization and Commitment in Corporate Social Responsibility,American Sociological Review,article,1,77,Kiyoteru Tsutsui; Alwyn Lim
2009,A Pragmatist Theory of Social Mechanisms,American Sociological Review,article,3,74,Neil Gross
2008,Make Money Surfing the Web? The Impact of Internet Use on the Earnings of U.S. Workers,American Sociological Review,article,2,73,Paul DiMaggio; Bart Bonikowski
2013,"The Capitalist Machine: Computerization, Workers' Power, and the Decline in Labor's Share within U.S. Industries",American Sociological Review,article,3,78,Tali Kristal
2018,Precarious Sexuality: How Men and Women Are Differentially Categorized for Similar Sexual Behavior,American Sociological Review,article,2,83,Trenton D. Mize; Bianca Manago
1967,Religious Identity and Church Attendance of Sons of Religious Intermarriages,American Sociological Review,article,1,32,Sydney H. Croog; James E. Teele
2011,Socioeconomic Status and the Increased Prevalence of Autism in California,American Sociological Review,article,2,76,Marissa D. King; Peter S. Bearman
1984,Unemployment and Criminal Involvement: An Investigation of Reciprocal Causal Structures,American Sociological Review,article,3,49,Terence P. Thornberry; R. L. Christenson
2005,"Sovereignty Relinquished? Explaining Commitment to the International Human Rights Covenants, 1966-1999",American Sociological Review,article,3,70,Wade M. Cole
2018,"Educational Inequality, Educational Expansion, and Intergenerational Income Persistence in the United States",American Sociological Review,article,6,83,Deirdre Bloome; Xiang Zhou; Shauna Dyer
1969,Dilemmas of a Golden Exile: Integration of Cuban Refugee Families in Milwaukee,American Sociological Review,article,4,34,Alejandro Portes
2008,Beyond the Industrial Paradigm: Market-Embedded Labor and the Gender Organization of Global Service Work in China,American Sociological Review,article,1,73,Eileen M. Otis
1987,Classification in Art,American Sociological Review,article,4,52,Paul DiMaggio
2019,Structural Sexism and Health in the United States: A New Perspective on Health Inequality and the Gender System,American Sociological Review,article,3,84,Patricia Homan
2016,"Do Highly Paid, Highly Skilled Women Experience the Largest Motherhood Penalty?",American Sociological Review,article,6,81,Paula England; Melissa J. Hodges; Jonathan Bearak; Michelle J. Budig
1987,More on Occupational Mobility and Social Class,American Sociological Review,article,3,52,C. Matthew Snipp
2001,"How Movements Win: Gendered Opportunity Structures and U.S. Women's Suffrage Movements, 1866 to 1919",American Sociological Review,article,1,66,Holly J. McCammon; Karen E. Campbell; Ellen M. Granberg; Christine Mowery
1963,Family Structure and Child-Rearing Patterns: The Effect of Family Size and Sex Composition,American Sociological Review,article,6,28,"Glen H. Elder, Jr.; Charles E. Bowerman"
1972,A Theory of Ethnic Antagonism: The Split Labor Market,American Sociological Review,article,5,37,Edna Bonacich
1961,Function and Cause,American Sociological Review,article,6,26,Ronald Philip Dore
2011,“I Need Help!” Social Class and Children’s Help-Seeking in Elementary School,American Sociological Review,article,6,76,Jessica McCrory Calarco
1981,Interpreting Linear Differential Equation Models,American Sociological Review,article,6,46,Francois Nielsen; Rachel A. Rosenfeld
2006,The Growing Female Advantage in College Completion: The Role of Family Background and Academic Achievement,American Sociological Review,article,4,71,Claudia Buchmann; Thomas A. DiPrete
2004,Does Firm Size Matter Anymore? The New Economy and Firm Size Wage Effects,American Sociological Review,article,5,69,Matissa N. Hollister
1990,Communication Dilemmas in Social Networks: An Experimental Study,American Sociological Review,article,3,55,Phillip Bonacich
1982,"Reply to Comment by Smith, Mason, and Fienberg",American Sociological Review,article,6,47,Willard L. Rodgers
1991,"Group Differences in Economic Opportunity and the Timing of Marriage: Blacks and Whites in the Rural South, 1910",American Sociological Review,article,1,56,Nancy S. Landale; Stewart E. Tolnay
2016,Neighborhood Attainment over the Adult Life Course,American Sociological Review,article,6,81,Scott J. South; Ying Huang; Amy Spring; Kyle Crowder
1965,A Method of Linear Causal Analysis: Dependence Analysis,American Sociological Review,article,3,30,Raymond Boudon
1998,Creating Status Characteristics,American Sociological Review,article,3,63,"Murray Webster, Jr.; Stuart J. Hysom"
2010,Who Benefits Most from College?,American Sociological Review,article,2,75,Jennie E. Brand; Yu Xie
1994,The Decline and Fall of the Conglomerate Firm in the 1980s: The Deinstitutionalization of an Organizational Form,American Sociological Review,article,4,59,Gerald F. Davis; Kristina A. Diekmann; Catherine H. Tinsley
1985,The Consequences of Parenthood for the Marital Stability of Young Adults,American Sociological Review,article,6,50,Linda J. Waite; Gus W. Haggstrom; David E. Kanouse
2007,How Puerto Rico Became White: Boundary Dynamics and Intercensus Racial Reclassification,American Sociological Review,article,6,72,Mara Loveman; Jeronimo O. Muniz
2010,Neighborhood Context and the Gender Gap in Adolescent Violent Crime,American Sociological Review,article,6,75,Gregory M. Zimmerman; Steven F. Messner
2005,A Comparative Study of Inequality and Corruption,American Sociological Review,article,1,70,Sanjeev Khagram; You Jong-sung
2020,"De-gendered Processes, Gendered Outcomes: How Egalitarian Couples Make Sense of Non-egalitarian Household Practices",American Sociological Review,article,5,85,Allison Daminger
1988,Attitude Strength and Social Action in the Abortion Dispute,American Sociological Review,article,5,53,Jacqueline Scott; Howard Schuman
1993,"Citizenship and the Place of the Public Sphere: Law, Community, and Political Culture in the Transition to Democracy",American Sociological Review,article,5,58,Margaret R. Somers
1974,Group Disorders in the Public School: A Comment,American Sociological Review,article,1,39,James P. Pitts
2000,A New Solution to the Collective Action Problem: The Paradox of Voter Turnout,American Sociological Review,article,3,65,Satoshi Kanazawa
1999,Bilingualism and the Academic Achievement of First- and Second-Generation Asian Americans: Accommodation with or without Assimilation?,American Sociological Review,article,2,64,Ted Mouw; Yu Xie
1977,"Reply to Bagozzi, Berk, Bohrnstedt, Pope and Ragin, and Wasserman",American Sociological Review,article,4,42,James M. Inverarity
2018,The Cultural-Cognitive Mapping of Scientific Professions,American Sociological Review,article,3,83,Kenneth T. Andrews; Gordon Gauchat
1974,The Influence of Suggestion on Suicide: Substantive and Theoretical Implications of the Werther Effect,American Sociological Review,article,3,39,David P. Phillips
2009,"Deciding to Discipline: Race, Choice, and Punishment at the Frontlines of Welfare Reform",American Sociological Review,article,3,74,Sanford F. Schram; Joe Soss; Richard C. Fording; Linda Houser
1965,Anomy: Reply to Srole and Nettler,American Sociological Review,article,5,30,Herbert McClosky; John H. Schaar
2009,Why Targets Matter: Toward a More Inclusive Model of Collective Violence,American Sociological Review,article,5,74,Andrew W. Martin; John D. McCarthy; Clark McPhail
1966,Models of Behavior in Stalinist Literature: A Case Study of Totalitarian Values and Controls,American Sociological Review,article,3,31,Paul Hollander
2017,"Seeing Like the Fed: Culture, Cognition, and Framing in the Failure to Anticipate the Financial Crisis of 2008",American Sociological Review,article,5,82,Neil Fligstein; Jonah Stuart Brundage; Michael Schultz
1986,Productivity as a Social Problem: The Uses and Misuses of Social Indicators,American Sociological Review,article,6,51,Fred Block; Gene A. Burns
1979,"Race, Regional Labor Markets and Earnings",American Sociological Review,article,2,44,Toby L. Parcel
2002,Commemorating a Difficult past: Yitzhak Rabin's Memorials,American Sociological Review,article,1,67,Vered Vinitzky-Seroussi
2004,What Is Originality in the Humanities and the Social Sciences?,American Sociological Review,article,2,69,Joshua Guetzkow; Michèle Lamont; Grégoire Mallard
2003,Space Meets Time: Integrating Temporal and Contextual Influences on Mental Health in Early Adulthood,American Sociological Review,article,5,68,Blair Wheaton; Philippa Clarke
2018,Political Consequences of Survival Strategies among the Urban Poor,American Sociological Review,article,5,83,Matthew Desmond; Adam Travis
2016,"Do Highly Paid, Highly Skilled Women Experience the Largest Motherhood Penalty?",American Sociological Review,article,6,81,Paula England; Jonathan Bearak; Michelle J. Budig; Melissa J. Hodges
2020,Scientific Hegemony and the Field of Autism,American Sociological Review,article,3,85,Claire Laurier Decoteau; Meghan Daniel
1982,"One Step Forward, Two Steps Back: More on the Class/Criminality Controversy",American Sociological Review,article,3,47,Charles R. Tittle; Wayne J. Villemez; Douglas A. Smith
2016,How Parents Fare,American Sociological Review,article,5,81,Kelly Musick; Ann Meier; Sarah Flood
2018,The Social Ecology of Speculation,American Sociological Review,article,6,83,Adam Goldstein
1996,Self-Employment and the Earnings of Immigrants,American Sociological Review,article,2,61,Alejandro Portes; Min Zhou
2009,Why Targets Matter: Toward a More Inclusive Model of Collective Violence,American Sociological Review,article,5,74,Andrew W. Martin; Clark McPhail; John D. McCarthy
1969,The Classification of Subnations in Hawaii: An Essay in the Sociology of Knowledge,American Sociological Review,article,6,34,William Petersen
2005,Cross-National Cultural Diffusion: The Global Spread of Cricket,American Sociological Review,article,1,70,Jason Kaufman; Orlando Patterson
1979,"Structural Determinants of Urbanization in Asia and Latin America, 1950- 1970",American Sociological Review,article,2,44,Glenn Firebaugh
1978,A Rule for Inferring Individual-Level Relationships from Aggregate Data,American Sociological Review,article,4,43,Glenn Firebaugh
2014,"Unmasking the Conflicting Trends in Job Tenure by Gender in the United States, 1983-2008",American Sociological Review,article,1,79,Matissa N. Hollister; Kristin E. Smith
2011,Protesting While Black?,American Sociological Review,article,1,76,David A. Armstrong II; Christian Davenport; Sarah A. Soule
2007,"Animal Practices, Ethnicity, and Community: The Turkish Pigeon Handlers of Berlin",American Sociological Review,article,6,72,Colin Jerolmack
2018,The Authentic Appeal of the Lying Demagogue: Proclaiming the Deeper Truth about Political Illegitimacy,American Sociological Review,article,1,83,Oliver Hahl; Minjae Kim; Ezra W. Zuckerman Sivan
2014,Overwork and the Slow Convergence in the Gender Gap in Wages,American Sociological Review,article,3,79,Youngjoo Cha; Kim A. Weeden
1961,"On the Investigation of Cruelty, Dignity, and Determinism",American Sociological Review,article,2,26,Robert Kastenbaum
2004,Structural Incoherence and Stock Market Activity,American Sociological Review,article,3,69,Ezra W. Zuckerman
1981,Beliefs vs. Data: More on the Illness Behavior of Men and Women,American Sociological Review,article,1,46,Walter R. Gove; Michael Hughes
1968,The Future of Upward Mobility,American Sociological Review,article,1,33,John Porter
2003,Protest under Fire? Explaining the Policing of Protest,American Sociological Review,article,4,68,Jennifer Earl; Sarah A. Soule; John D. McCarthy
1984,"Education and Intergroup Attitudes: Moral Enlightenment, Superficial Democratic Commitment, or Ideological Refinement?",American Sociological Review,article,6,49,Mary R. Jackman; Michael J. Muha
1983,A Spatial Autocorrelation Model of the Effects of Population Density on Fertility,American Sociological Review,article,1,48,Colin Loftin; Sally K. Ward
1976,Status Attainment and Status Maintenance: A Study of Stratification in Old Age,American Sociological Review,article,6,41,John C. Henretta; Richard T. Campbell
1966,"The Division of Labor, Technology, and the Organization of Production in Twelve Countries",American Sociological Review,article,1,31,Jack P. Gibbs; Harley L. Browning
2006,"The Conditional Nature of Embeddedness: A Study of Borrowing by Large U.S. Firms, 1973–1994",American Sociological Review,article,2,71,Linda Brewster Stearns; Mark S. Mizruchi
1980,Unconfounding the Confluence Model: A Test of Sibship Size and Birth-Order Effects on Intelligence,American Sociological Review,article,4,45,Lala Carr Steelman; James A. Mercy
1988,Occupational Disputes in Mechanical and Organic Social Systems: An Empirical Study of Elementary and Secondary Schools,American Sociological Review,article,4,53,Ronald G. Corwin; Robert E. Herriott
2015,Elements of Professional Expertise,American Sociological Review,article,5,80,Rebecca L. Sandefur
2014,"Union Strength, Neoliberalism, and Inequality: Contingent Political Analyses of U.S. Income Differences since 1950",American Sociological Review,article,4,79,David Jacobs; Lindsey Myers
1979,Making it in America: Differences Between Eminent Blacks and White Ethnic Groups,American Sociological Review,article,3,44,Stanley Lieberson; Donna K. Carter
2011,"Toward a Theory of Cultural Appropriation: Buddhism, the Vietnam War, and the Field of U.S. Poetry",American Sociological Review,article,4,76,Barιş Büyükokutan
1953,Student Reaction to Impending Military Service,American Sociological Review,article,3,18,"Edward A. Suchman; Robin M. Williams, Jr.; Rose K. Goldsen"
2008,"The Rise of Intra-Occupational Wage Inequality in the United States, 1983 to 2002",American Sociological Review,article,1,73,ChangHwan Kim; Arthur Sakamoto
2012,Segregation and Poverty Concentration: The Role of Three Segregations,American Sociological Review,article,3,77,Lincoln Quillian
1956,The Elements of Identification with an Occupation,American Sociological Review,article,3,21,Howard S. Becker; James Carper
2017,What Makes Popular Culture Popular? Product Features and Optimal Differentiation in Music,American Sociological Review,article,5,82,Michael Mauskapf; Noah Askin
1991,Ethnic Movements and the Competition Model: Some Missing Links,American Sociological Review,article,4,56,Sarah Bélanger; Maurice Pinard
1936,Civilization and Culture: A Contribution Toward Analysis of the Mechanism of Culture,American Sociological Review,article,3,1,Richard C. Thurnwald
2006,"Networks, Race, and Hiring",American Sociological Review,article,1,71,Isabel Fernandez-Mateo; Roberto M. Fernandez
1982,Testing the Theory of Status Integration and Suicide Rates,American Sociological Review,article,2,47,Jack P. Gibbs
1936,American Intellectuals and Social Reform,American Sociological Review,article,3,1,Howard B. Woolston
1981,Logistic Regression Models with Continuous Independent Variables,American Sociological Review,article,6,46,Paul P. L. Cheung; Herbert L. Smith
2014,Economies of Dying: The Moralization of Economic Scarcity in U.S. Hospice Care,American Sociological Review,article,5,79,Roi Livne
2010,Who Benefits Most from College? Evidence for Negative Selection in Heterogeneous Economic Returns to Higher Education,American Sociological Review,article,2,75,Jennie E. Brand; Yu Xie
1960,Illegitimacy in the Caribbean Social Structure,American Sociological Review,article,1,25,William J. Goode
1979,The Paradigm Concept and Sociology: A Critical Review,American Sociological Review,article,6,44,"Douglas Lee Eckberg; Lester Hill, Jr."
2019,Between Tolerant Containment and Concerted Constraint,American Sociological Review,article,4,84,Neil Gong
1972,Cumulative Sociological Knowledge,American Sociological Review,article,4,37,Lee Freese
1982,"Reply to ""On the Use of Self-Report Data to Determine the Class Distribution of Criminal and Delinquent Behavior""",American Sociological Review,article,3,47,Travis Hirschi; Michael J. Hindelang; Joseph Weis
2018,The Cultural-Cognitive Mapping of Scientific Professions,American Sociological Review,article,3,83,Gordon Gauchat; Kenneth T. Andrews
2018,Political Consequences of Survival Strategies among the Urban Poor,American Sociological Review,article,5,83,Matthew Desmond; Adam Travis
2015,How National Institutions Mediate the Global,American Sociological Review,article,5,80,Giselinde Kuipers
1994,A Logical Approach to Formalizing Organizational Ecology,American Sociological Review,article,4,59,Gábor Péli; Jeroen Bruggeman; Michael Masuch; Breanndán Ó Nualláin
2018,The Authentic Appeal of the Lying Demagogue: Proclaiming the Deeper Truth about Political Illegitimacy,American Sociological Review,article,1,83,Oliver Hahl; Minjae Kim; Ezra W. Zuckerman Sivan
2005,"From Poverty to Perversity: Ideas, Markets, and Institutions over 200 Years of Welfare Debate",American Sociological Review,article,2,70,Margaret R. Somers; Fred Block
2020,Pluralistic Collapse: The “Oil Spill” Model of Mass Opinion Polarization,American Sociological Review,article,3,85,Daniel DellaPosta
2006,"Care in Context: Men's Unpaid Work in 20 Countries, 1965–2003",American Sociological Review,article,4,71,Jennifer L. Hook
2004,Racial and Ethnic Differences in Marriage after the Birth of a Child,American Sociological Review,article,6,69,Kristen Harknett; Sara S. McLanahan
2011,"""I Need Help!"" Social Class and Children's Help-Seeking in Elementary School",American Sociological Review,article,6,76,Jessica McCrory Calarco
1989,Religion and the Rise of Liberal-Democratic Ideology in 17th-Century England,American Sociological Review,article,2,54,David Zaret
1980,"Heredity, Environment, and Public Policy Reconsidered",American Sociological Review,article,5,45,Christopher Jencks
2014,Overwork and the Slow Convergence in the Gender Gap in Wages,American Sociological Review,article,3,79,Kim A. Weeden; Youngjoo Cha
1983,"Race, Political Orientation, and Participation: An Empirical Test of Four Competing Theories",American Sociological Review,article,4,48,Thomas M. Guterbock; Bruce London
2005,Unequal But Fluid: Social Mobility in Chile in Comparative Perspective,American Sociological Review,article,3,70,Florencia Torche
1980,Mead and Blumer: The Convergent Methodological Perspectives of Social Behaviorism and Symbolic Interactionism,American Sociological Review,article,3,45,Herbert Blumer
2009,Ethnic Politics and Armed Conflict: A Configurational Analysis of a New Global Data Set,American Sociological Review,article,2,74,Andreas Wimmer; Lars-Erik Cederman; Brian Min
1965,Social Class and Premarital Sexual Permissiveness: A Re-Examination,American Sociological Review,article,5,30,Ira L. Reiss
2020,Elaborating on the Abstract: Group Meaning-Making in a Colombian Microsavings Program,American Sociological Review,article,3,85,Kristen McNeill; Laura B. Doering
2012,Segregation and Poverty Concentration,American Sociological Review,article,3,77,Lincoln Quillian
1957,Social Class Differences in Child Rearing: A Third Community for Comparison with Chicago and Newton,American Sociological Review,article,6,22,Richard A. Littman; Robert C. A. Moore; John Pierce-Jones
2002,Forging Social Order and Its Breakdown: Riot and Reform in U.S. Prisons,American Sociological Review,article,4,67,Bert Useem; Jack A. Goldstone
1997,The Spread of Sharecropping in Tuscany: The Political Economy of Transaction Costs,American Sociological Review,article,3,62,Rebecca Jean Emigh
2019,Structural Sexism and Health in the United States,American Sociological Review,article,3,84,Patricia Homan
1952,Review of Current Research on the Sociology of Rural Life,American Sociological Review,article,1,17,Neal Gross
2005,"Diffusion, Development, and Democracy, 1800-1999",American Sociological Review,article,1,70,Barbara Wejnert
