publicationYear,title,isPartOf,docType,issueNumber,volumeNumber,creator
1985,Unwelcome Immigrants: The Labor Market Experiences of 1980 (Mariel) Cuban and Haitian Refugees in South Florida,American Sociological Review,article,4,50,Alejandro Portes; Alex Stepick
1979,The Religious Switcher in the United States,American Sociological Review,article,4,44,Frank Newport
2006,"Blaming the Victims: Hearsay, Labeling, and the Hazards of Quick-Hit Disaster Ethnography",American Sociological Review,article,4,71,Eric Klinenberg
2014,Varieties of Capitalism and Job Quality: The Attainment of Civic Principles at Work in the United States and Germany,American Sociological Review,article,5,79,Carola Frege; John Godard
2012,Religion and Volunteering in Context: Disentangling the Contextual Effects of Religion on Voluntary Behavior,American Sociological Review,article,5,77,Chaeyoon Lim; Carol Ann MacGregor
1973,"""Ordinal Regression?"" A Comment",American Sociological Review,article,4,38,K. I. MacDonald
1989,Gender Stratification in Contemporary Urban Japan,American Sociological Review,article,4,54,Mary C. Brinton
2016,Racial Capitalism and the Crisis of Black Masculinity,American Sociological Review,article,5,81,Jordanna Matlon
2018,"The Social Sources of Geopolitical Power: French and British Diplomacy and the Politics of Interstate Recognition, 1689 to 1789",American Sociological Review,article,6,83,Jonah Stuart Brundage
2007,Climbing the Dispute Pagoda: Grievances and Appeals to the Official Justice System in Rural China,American Sociological Review,article,3,72,Ethan Michelson
2009,The Politics of Union Decline: The Contingent Determinants of Union Recognition Elections and Victories,American Sociological Review,article,5,74,Daniel Tope; David Jacobs
1962,Book Notes,American Sociological Review,article,1,27,
2018,The Societalization of Social Problems,American Sociological Review,article,6,83,Jeffrey C. Alexander
1980,"The Case of the Missing-Values Card, and Other Mysteries: Another Look at the Effect of Government Spending on Income Inequality",American Sociological Review,article,1,45,Glenn Firebaugh
1990,The Local Welfare State: Two Strategies for Social Domination in Urban Imperial Germany,American Sociological Review,article,6,55,George Steinmetz
2019,Measuring Automatic Cognition: Advancing Dual-Process Research in Sociology,American Sociological Review,article,2,84,Andrew Miles; Cyrus Schleifer; Raphaël Charron-Chénier
1966,The Friends and Supporters of Psychotherapy: On Social Circles in Urban Life,American Sociological Review,article,6,31,Charles Kadushin
1979,Confusion and Error in Kerckhoff and Parker: A Reply,American Sociological Review,article,2,44,Robert V. Robinson; Wendell Bell
2012,Educational Differences in U.S. Adult Mortality,American Sociological Review,article,4,77,Robert A. Hummer; Daniel A. Powers; Ryan K. Masters
1949,Race Patterns and Prejudice in Puerto Rico,American Sociological Review,article,2,14,Maxine W. Gordon
1989,Conceptualization of Terrorism,American Sociological Review,article,3,54,Jack P. Gibbs
2018,Scents and Sensibility,American Sociological Review,article,2,83,Karen A. Cerulo
2009,Ethnic Politics and Armed Conflict: A Configurational Analysis of a New Global Data Set,American Sociological Review,article,2,74,Lars-Erik Cederman; Brian Min; Andreas Wimmer
2013,How Macro-Historical Change Shapes Cultural Taste,American Sociological Review,article,2,78,Robert M. Fishman; Omar Lizardo
2003,In the Eye of the Beholder: Procedural Justice in Social Exchange,American Sociological Review,article,1,68,Linda D. Molm; Gretchen Peterson; Nobuyuki Takahashi
1936,Emergency and Permanent Legislation with Special Reference to the History of Subsistence Homesteads,American Sociological Review,article,4,1,Bruce L. Melvin
2013,The Association of Social Class and Lifestyles,American Sociological Review,article,4,78,Ivaylo D. Petev
1991,One Justified Criticism Plus Three Flawed Analyses Equals Two Unwarranted Conclusions: A Reply to Retherford and Sewell,American Sociological Review,article,2,56,R. B. Zajonc; Gregory B. Markus; Michael L. Berbaum; John A. Bargh; Richard L. Moreland
2009,The 2004 GSS Finding of Shrunken Social Networks: An Artifact?,American Sociological Review,article,4,74,Claude S. Fischer
2016,Sexual Orientation in the Labor Market,American Sociological Review,article,6,81,Trenton D. Mize
2012,Structure and Dynamics of Religious Insurgency,American Sociological Review,article,2,77,Hyojoung Kim; Steven Pfaff
2009,A Pragmatist Theory of Social Mechanisms,American Sociological Review,article,3,74,Neil Gross
1967,The Police on Skid-Row: A Study of Peace Keeping,American Sociological Review,article,5,32,Egon Bittner
1951,Identification as the Basis for a Theory of Motivation,American Sociological Review,article,1,16,Nelson N. Foote
1940,Intervening Opportunities: A Theory Relating Mobility and Distance,American Sociological Review,article,6,5,Samuel A. Stouffer
1963,"Interdependence, Differential Rewarding, and Productivity",American Sociological Review,article,5,28,L. Keith Miller; Robert L. Hamblin
1962,The Sociology of Empirical Social Research,American Sociological Review,article,6,27,Paul F. Lazarsfeld
2004,How Culture Mattered at Vatican II: Collegiality Trumps Authority in the Council's Social Movement Organizations,American Sociological Review,article,4,69,Melissa J. Wilde
2019,Hearing Gender: Voice-Based Gender Classification Processes and Transgender Health Inequality,American Sociological Review,article,5,84,Danya Lagos
1970,Problems in Making Policy Inferences from the Coleman Report,American Sociological Review,article,2,35,Glen G. Cain; Harold W. Watts
2007,Not by Productivity Alone: How Visibility and Specialization Contribute to Academic Earnings,American Sociological Review,article,4,72,Erin Leahey
1989,Murder and Capital Punishment: A Monthly Time-Series Analysis of Execution Publicity,American Sociological Review,article,5,54,William C. Bailey; Ruth D. Peterson
1990,Collective Sanctions and Compliance Norms: A Formal Theory of Group-Mediated Social Control,American Sociological Review,article,3,55,Douglas D. Heckathorn
2014,"Medical Adaptation to Academic Pressure: Schooling, Stimulant Use, and Socioeconomic Status",American Sociological Review,article,6,79,Jason M. Fletcher; Jennifer Jennings; Marissa D. King
2008,Beyond the Census Tract: Patterns and Determinants of Racial Segregation at Multiple Geographic Scales,American Sociological Review,article,5,73,Stephen A. Matthews; David O'Sullivan; Barrett A. Lee; Sean F. Reardon; Glenn Firebaugh; Chad R. Farrell
1999,Fueling the Politics of Age: On Economic Hardship across the Life Course: Comment on Mirowsky & Ross,American Sociological Review,article,4,64,Melissa A. Hardy; Lawrence E. Hazelrigg
2017,Ambiguity and Scientific Authority,American Sociological Review,article,1,82,Catherine Bliss; Aaron Panofsky
1991,Birth Order and Intelligence: Further Tests of the Confluence Model,American Sociological Review,article,2,56,Robert D. Retherford; William H. Sewell
2019,Mapping Cultural Schemas,American Sociological Review,article,5,84,M.B. Fallin Hunzaker; Lauren Valentino
2009,"Hispanics and Organized Labor in the United States, 1973 to 2007",American Sociological Review,article,6,74,Meredith Kleykamp; Jake Rosenfeld
2004,"Comment on Zajac and Westphal, ASR, June 2004: Towards the Social Reconstruction of an Interdisciplinary Turf War",American Sociological Review,article,3,69,Ezra W. Zuckerman
2017,Horizontal Immobility: How Narratives of Neighborhood Violence Shape Housing Decisions,American Sociological Review,article,2,82,Eva Rosen
2009,Groups Reward Individual Sacrifice: The Status Solution to the Collective Action Problem,American Sociological Review,article,1,74,Robb Willer
2015,Elements of Professional Expertise: Understanding Relational and Substantive Expertise through Lawyers' Impact,American Sociological Review,article,5,80,Rebecca L. Sandefur
2005,Civic Associations and Authoritarian Regimes in Interwar Europe: Italy and Spain in Comparative Perspective,American Sociological Review,article,2,70,Dylan Riley
2019,The Cognitive Dimension of Household Labor,American Sociological Review,article,4,84,Allison Daminger
2018,Difficult People: Who Is Perceived to Be Demanding in Personal Networks and Why Are They There?,American Sociological Review,article,1,83,Shira Offer; Claude S. Fischer
2002,The Search for Oppositional Culture among Black Students,American Sociological Review,article,1,67,Douglas B. Downey; James W. Ainsworth-Darnell
1966,Research on Socialization and Personality Development in the United States and France: Remarks on the Paper by Professor Chombart de Lauwe,American Sociological Review,article,2,31,John A. Clausen
1989,The Real and Unrealized Contributions of Quantitative Sociology,American Sociological Review,article,3,54,"Hubert M. Blalock, Jr."
2014,"Unmasking the Conflicting Trends in Job Tenure by Gender in the United States, 1983–2008",American Sociological Review,article,1,79,Kristin E. Smith; Matissa N. Hollister
1991,"It Happened Here: Political Opportunity, the New Institutionalism, and the Townsend Movement",American Sociological Review,article,2,56,Edwin Amenta; Yvonne Zylan
1992,The Effects of Attitudes on Teenage Premarital Pregnancy and its Resolution,American Sociological Review,article,6,57,Robert D. Plotnick
2019,Crossing Categorical Boundaries: A Study of Diversification by Social Movement Organizations,American Sociological Review,article,3,84,Sarah A. Soule; Dan J. Wang; Hayagreeva Rao
1998,The Evolution of Trust and Cooperation between Strangers: A Computational Model,American Sociological Review,article,5,63,Michael W. Macy; John Skvoretz
2002,The Political Sociology of the Death Penalty: A Pooled Time-Series Analysis,American Sociological Review,article,1,67,David Jacobs; Jason T. Carmichael
1990,Macro-Micro Links in Gender Stratification: 1989 Presidential Address,American Sociological Review,article,1,55,Joan Huber
1957,The Formal Analysis of Normative Concepts,American Sociological Review,article,1,22,Alan Ross Anderson; Omar Khayyam Moore
2017,"Rising Intragenerational Occupational Mobility in the United States, 1969 to 2011",American Sociological Review,article,3,82,Benjamin F. Jarvis; Xi Song
1988,The Formative Years of U.S. Social Spending Policies: Theories of the Welfare State and the American States During the Great Depression,American Sociological Review,article,5,53,Edwin Amenta; Bruce G. Carruthers
1987,Limits of Ethnic Solidarity in the Enclave Economy,American Sociological Review,article,6,52,Jimy M. Sanders; Victor Nee
2000,Is Engineering Hostile to Women? An Analysis of Data from the 1993 National Survey of College Graduates,American Sociological Review,article,2,65,Laurie A. Morgan
2010,Neighborhood Context and the Gender Gap in Adolescent Violent Crime,American Sociological Review,article,6,75,Gregory M. Zimmerman; Steven F. Messner
2001,Marriage Delayed or Marriage Forgone? New Cohort Forecasts of First Marriage for U.S. Women,American Sociological Review,article,4,66,Joshua R. Goldstein; Catherine T. Kenney
2018,It’s Only Wrong If It’s Transactional,American Sociological Review,article,6,83,Oliver Schilke; Gabriel Rossman
2013,Pathways to Empowerment,American Sociological Review,article,4,78,Cheol-Sung Lee; Maria Akchurin
2010,Cultural Foundations of Tokenism: Evidence from the Leveraged Buyout Industry,American Sociological Review,article,6,75,Catherine J. Turco
1946,The Ward-Ross Correspondence II 1897-1901,American Sociological Review,article,5,11,Bernhard J. Stern
2006,Deterring Delinquents: A Rational Choice Model of Theft and Violence,American Sociological Review,article,1,71,David Huizinga; Ross L. Matsueda; Derek A. Kreager
2004,"“Generations and Collective Memory” Revisited: Race, Region, and Memory of Civil Rights",American Sociological Review,article,4,69,Larry J. Griffin
2016,"Whose Backyard and What's at Issue? Spatial and Ideological Dynamics of Local Opposition to Fracking in New York State, 2010 to 2013",American Sociological Review,article,5,81,Fedor A. Dokshin
1941,Supreme Values and the Sociologist,American Sociological Review,article,2,6,Howard Becker
1993,Family Structure and the Risk of a Premarital Birth,American Sociological Review,article,2,58,Lawrence L. Wu; Brian C. Martinson
1957,Priorities in Scientific Discovery: A Chapter in the Sociology of Science,American Sociological Review,article,6,22,Robert K. Merton
2000,"Work as a Turning Point in the Life Course of Criminals: A Duration Model of Age, Employment, and Recidivism",American Sociological Review,article,4,65,Christopher Uggen
1985,"Same Time, Last Year: Selective Data Dredging for Negative Findings",American Sociological Review,article,3,50,David P. Phillips; Kenneth A. Bollen
2009,"Social Class, School and Non-School Environments, and Black/White Inequalities in Children's Learning",American Sociological Review,article,5,74,Dennis J. Condron
2004,Structural Incoherence and Stock Market Activity,American Sociological Review,article,3,69,Ezra W. Zuckerman
2017,Denunciation and Social Control,American Sociological Review,article,2,82,Patrick Bergemann
2007,Workers of the Less Developed World Unite? A Multilevel Analysis of Unionization in Less Developed Countries,American Sociological Review,article,4,72,David Brady; Nathan D. Martin
2012,Symmetry Is Beautiful,American Sociological Review,article,6,77,Uri Shwed; Peter S. Bearman
1976,Career Attributes and Network Structure: A Blockmodel Study of a Biomedical Research Specialty,American Sociological Review,article,1,41,Ronald L. Brieger
2010,The Temporal Structure of Scientific Consensus Formation,American Sociological Review,article,6,75,Uri Shwed; Peter S. Bearman
1988,Grievances and Participation in Social Movements,American Sociological Review,article,6,53,Karl-Dieter Opp
1993,Booing: The Anatomy of a Disaffiliative Response,American Sociological Review,article,1,58,Steven E. Clayman
2019,The Relation between Inequality and Intergenerational Class Mobility in 39 Countries,American Sociological Review,article,6,84,Florian R. Hertel; Olaf Groh-Samberg
2013,"The Care Economy? Gender, Economic Restructuring, and Job Polarization in the U.S. Labor Market",American Sociological Review,article,3,78,Rachel E. Dwyer
2012,Politics of Organizational Adornment: Lessons from Las Vegas and Beyond,American Sociological Review,article,1,77,Jeffrey J. Sallaz
1978,"Reply to Stumpp, Marsh, and Lake",American Sociological Review,article,4,43,Christopher Chase-Dunn
1969,Physicians and Medicare: A Before-After Study of the Effects of Legislation on Attitudes,American Sociological Review,article,3,34,John Colombotos
2014,Entrepreneurship as a Mobility Process,American Sociological Review,article,2,79,Jesper B. Sørensen; Amanda J. Sharkey
1989,Immigrant Entrepreneurship: Effects of Ethnic Market Size and Isolated Labor Pool,American Sociological Review,article,6,54,M. D. R. Evans
2014,"Prenatal Exposure to Violence and Birth Weight in Mexico: Selectivity, Exposure, and Behavioral Responses",American Sociological Review,article,5,79,Andrés Villarreal; Florencia Torche
2017,Horizontal Immobility,American Sociological Review,article,2,82,Eva Rosen
1962,Achievement Motivation and Religious Background,American Sociological Review,article,2,27,Joseph Veroff; Sheila Feld; Gerald Gurin
1983,The Norm of Even-Handedness in Surveys as in Life,American Sociological Review,article,1,48,Howard Schuman; Jacob Ludwig
2006,Free-Market and Religious Fundamentalists versus Poor Relief,American Sociological Review,article,3,71,Alexander Hicks
2009,Discrimination in a Low-Wage Labor Market,American Sociological Review,article,5,74,Devah Pager; Bart Bonikowski; Bruce Western
1976,Reply to Carroll,American Sociological Review,article,6,41,William D. Crano; Joel Aronoff
2006,Is there No Place for Culture in a Sociology of Legal and Illegal Enterprise?,American Sociological Review,article,1,71,Jeffery T. Ulmer; Darrell Steffensmeier
2005,"From Poverty to Perversity: Ideas, Markets, and Institutions over 200 Years of Welfare Debate",American Sociological Review,article,2,70,Fred Block; Margaret R. Somers
2017,Cultural Meanings and the Aggregation of Actions: The Case of Sex and Schooling in Malawi,American Sociological Review,article,5,82,Margaret Frye
1995,Class and Class Conflict in Six Western Nations,American Sociological Review,article,2,60,Jonathan Kelley; M. D. R. Evans
1996,Using Racial and Ethnic Concepts: The Critical Case of Very Young Children,American Sociological Review,article,5,61,Debra Van Ausdale; Joe R. Feagin
2009,Reply to Fischer: Models and Marginals: Using Survey Evidence to Study Social Networks,American Sociological Review,article,4,74,Miller McPherson; Lynn Smith-Lovin; Matthew E. Brashears
1995,A Comparative Study of Working-Class Disorganization: Union Decline in Eighteen Advanced Capitalist Countries,American Sociological Review,article,2,60,Bruce Western
2011,"How General Is Trust in ""Most People""? Solving the Radius of Trust Problem",American Sociological Review,article,5,76,Jan Delhey; Kenneth Newton; Christian Welzel
1976,A Practitioner's Perspective on the Index of Dissimilarity,American Sociological Review,article,5,41,Karl E. Taeuber; Alma F. Taeuber
2006,When Do National Movements Adopt or Reject International Agendas? A Comparative Analysis of the Chinese and Indian Women's Movements,American Sociological Review,article,6,71,Dongxiao Liu
1993,The Social Organization of Conspiracy: Illegal Networks in the Heavy Electrical Equipment Industry,American Sociological Review,article,6,58,Wayne E. Baker; Robert R. Faulkner
2006,Is Telling Stories Good for Democracy? Rhetoric in Public Deliberation after 9/II,American Sociological Review,article,5,71,Francesca Polletta; John Lee
1991,Family of Origin and Cohort Differences in Verbal Ability,American Sociological Review,article,5,56,Duane F. Alwin
1980,The Flemish Movement in Belgium After World War II: A Dynamic Analysis,American Sociological Review,article,1,45,François Nielsen
1962,A Plea for a Decent Burial,American Sociological Review,article,6,27,Raymond E. Wolfinger
1941,Religion in a Rural Community of the South,American Sociological Review,article,2,6,Frank D. Alexander
2017,What Makes Popular Culture Popular? Product Features and Optimal Differentiation in Music,American Sociological Review,article,5,82,Noah Askin; Michael Mauskapf
1976,Reply to Alexander and Griffin,American Sociological Review,article,4,41,Charles E. Bidwell; John D. Kasarda
1976,The Literary Rhetoric of Science: Comedy and Pathos in Drinking Driver Research,American Sociological Review,article,1,41,Joseph Gusfield
2006,Movements and Memory: The Making of the Stonewall Myth,American Sociological Review,article,5,71,Elizabeth A. Armstrong; Suzanna M. Crage
2006,"Blaming the Victims: Hearsay, Labeling, and the Hazards of Quick-Hit Disaster Ethnography",American Sociological Review,article,4,71,Eric Klinenberg
1977,Distributive Justice and Earned Income,American Sociological Review,article,4,42,Guillermina Jasso; Peter H. Rossi
1966,Social Status and Psychological Disorder: An Issue of Substance and an Issue of Method,American Sociological Review,article,1,31,Bruce P. Dohrenwend
1981,Paradigm Analysis in Sociology: Clarifying the Issues,American Sociological Review,article,2,46,George Ritzer
2017,Cultural Meanings and the Aggregation of Actions: The Case of Sex and Schooling in Malawi,American Sociological Review,article,5,82,Margaret Frye
2007,Who Pays the Price of Brokerage? Transferring Constraint through Price Setting in the Staffing Sector,American Sociological Review,article,2,72,Isabel Fernandez-Mateo
2018,Risky Investments: How Local and Foreign Investors Finesse Corruption-Rife Emerging Markets,American Sociological Review,article,4,83,Kimberly Kay Hoang
2002,Assessing Alternative Perspectives on Race and Sex Employment Segregation,American Sociological Review,article,4,67,Robert L. Kaufman
1961,Book Notes,American Sociological Review,article,2,26,
2007,The Winds of Change: The Progressive Movement and the Bureaucratization of Thrift,American Sociological Review,article,1,72,Heather A. Haveman; Hayagreeva Rao; Srikanth Paruchuri
2013,Pathways to Empowerment: Repertoires of Women's Activism and Gender Earnings Equality,American Sociological Review,article,4,78,Maria Akchurin; Cheol-Sung Lee
1992,"Sociology, Ideology, and Nation-Building: The Palestinians and Their Meaning in Israeli Sociology",American Sociological Review,article,4,57,Baruch Kimmerling
2004,The Academic Caste System: Prestige Hierarchies in PhD Exchange Networks,American Sociological Review,article,2,69,Val Burris
2004,Does Firm Size Matter Anymore? The New Economy and Firm Size Wage Effects,American Sociological Review,article,5,69,Matissa N. Hollister
2019,Performative State-Formation in the Early American Republic,American Sociological Review,article,2,84,Isaac Ariail Reed
2013,How Macro-Historical Change Shapes Cultural Taste: Legacies of Democratization in Spain and Portugal,American Sociological Review,article,2,78,Robert M. Fishman; Omar Lizardo
1953,Book Notes,American Sociological Review,article,6,18,
2017,Demonstrating Power,American Sociological Review,article,2,82,Stefaan Walgrave; Ruud Wouters
2011,Toward a Theory of Cultural Appropriation,American Sociological Review,article,4,76,Barış Büyükokutan
1983,"Salience, Heterogeneity and Consolidation of Parameters: Civilizing Blau's Primitive Theory",American Sociological Review,article,3,48,John Skvoretz
1985,User's Guide to Ratio Variables,American Sociological Review,article,5,50,Glenn Firebaugh; Jack P. Gibbs
1984,Karl Mannheim and Conservatism: The Ancestry of Historical Thinking,American Sociological Review,article,1,49,David Kettler; Volker Meja; Nico Stehr
2006,Is Telling Stories Good for Democracy? Rhetoric in Public Deliberation after 9/11,American Sociological Review,article,5,71,John Lee; Francesca Polletta
2019,"Linked Lives, Linked Trajectories",American Sociological Review,article,6,84,Siwei Cheng; Xi Song
2011,Socioeconomic Status and the Increased Prevalence of Autism in California,American Sociological Review,article,2,76,Marissa D. King; Peter S. Bearman
2019,Does Intra-household Contagion Cause an Increase in Prescription Opioid Use?,American Sociological Review,article,4,84,Mathijs de Vaan; Toby Stuart
1974,American Big Business Ideology: A Content Analysis of Executive Speeches,American Sociological Review,article,6,39,Maynard S. Seider
1979,Temporal Changes in Work Content,American Sociological Review,article,6,44,Kenneth I. Spenner
1994,Male Flight from Computer Work: A New Look at Occupational Resegregation and Ghettoization,American Sociological Review,article,4,59,Rosemary Wright; Jerry A. Jacobs
2017,Improving Cultural Analysis: Considering Personal Culture in its Declarative and Nondeclarative Modes,American Sociological Review,article,1,82,Omar Lizardo
1943,Residential Propinquity as a Factor in Marriage Selection: Fifty Year Trends in Philadelphia,American Sociological Review,article,3,8,Ray H. Abrams
2019,Public Ideas: Their Varieties and Careers,American Sociological Review,article,3,84,Orla Stapleton; Tim Hallett; Michael Sauder
2013,"Decomposing School Resegregation: Social Closure, Racial Imbalance, and Racial Isolation",American Sociological Review,article,5,78,Jeremy E. Fiel
1977,Trends in Racial Inequalities: Have the Gains of the 1960s Disappeared in the 1970s?,American Sociological Review,article,2,42,Reynolds Farley
2014,"Medical Adaptation to Academic Pressure: Schooling, Stimulant Use, and Socioeconomic Status",American Sociological Review,article,6,79,Marissa D. King; Jennifer Jennings; Jason M. Fletcher
2016,"Money Supply, Class Power, and Inflation",American Sociological Review,article,3,81,Ho-fung Hung; Daniel Thompson
2018,A Systematic Assessment of “Axial Age” Proposals Using Global Comparative Historical Evidence,American Sociological Review,article,3,83,Daniel Austin Mullins; Harvey Whitehouse; Thomas Currie; Kevin Feeney; Daniel Hoyer; Pieter François; Peter Turchin; Christina Collins; Patrick E. Savage
1975,The Labelling Theory of Mental Illness: A Reply to Scheff,American Sociological Review,article,2,40,Walter R. Gove
1989,The Sources and Structure of Legitimation in Western Democracies: A Consolidated Model Tested with Time-Series Data in Six Countries Since World War II,American Sociological Review,article,5,54,Frederick D. Weil
2010,"Occupations and the Structure of Wage Inequality in the United States, 1980s to 2000s",American Sociological Review,article,3,75,Ted Mouw; Arne L. Kalleberg
1980,In Pursuit of Preconceptions: A Reply to the Claim of Booth and His Colleagues That Household Crowding is Not an Important Variable,American Sociological Review,article,5,45,Walter R. Gove; Michael Hughes
1982,"""Sociological Reductionism"" From Parsons to Althusser: Linking Action and Structure in Social Theory",American Sociological Review,article,1,47,Nancy DiTomaso
2003,Social Capital and Finding a Job: Do Contacts Matter?,American Sociological Review,article,6,68,Ted Mouw
2017,The New Closed Shop? The Economic and Structural Effects of Occupational Licensure,American Sociological Review,article,3,82,Beth Redbird
2014,"""Notable"" or ""Not Able"": When Are Acts of Inconsistency Rewarded?",American Sociological Review,article,2,79,Stoyan V. Sgourev; Niek Althuizen
1980,Worker Productivity at Hawthorne,American Sociological Review,article,6,45,Richard Herbert Franke
1952,The Relative Rate of Communication Between Members of Small Groups,American Sociological Review,article,4,17,Frederick F. Stephan
