publicationYear,title,isPartOf,docType,issueNumber,volumeNumber,creator
2010,The Temporal Structure of Scientific Consensus Formation,American Sociological Review,article,6,75,Uri Shwed; Peter S. Bearman
1993,Unorganized Interests and Collective Action in Communist China,American Sociological Review,article,1,58,Xueguang Zhou
2004,Towards the Social Reconstruction of an Interdisciplinary Turf War,American Sociological Review,article,3,69,Ezra W. Zuckerman
2005,2004 ASA Presidential Address: For Public Sociology,American Sociological Review,article,1,70,Michael Burawoy
2005,Border Crossing: Bricolage and the Erosion of Categorical Boundaries in French Gastronomy,American Sociological Review,article,6,70,Rodolphe Durand; Hayagreeva Rao; Philippe Monin
1988,Rethinking Macrosociological Theory,American Sociological Review,article,2,53,Gerhard Lenski
2004,Racial and Ethnic Differences in Marriage after the Birth of a Child,American Sociological Review,article,6,69,Kristen Harknett; Sara S. McLanahan
1950,Gang Membership and Juvenile Misconduct,American Sociological Review,article,6,15,William W. Wattenberg; James J. Balistrieri
2012,Structure and Dynamics of Religious Insurgency: Students and the Spread of the Reformation,American Sociological Review,article,2,77,Hyojoung Kim; Steven Pfaff
1975,Models of Status Inconsistency and Social Mobility Effects,American Sociological Review,article,3,40,Keith Hope
1981,Jasso on Distributive Justice,American Sociological Review,article,3,46,Karol Edward Sołtan
1981,Response to Bridges and Miller,American Sociological Review,article,5,46,Neil Fligstein; Michael Sobel; Wendy C. Wolf
2004,The Academic Caste System: Prestige Hierarchies in PhD Exchange Networks,American Sociological Review,article,2,69,Val Burris
1989,Social Integration and Longevity: An Event History Analysis of Women's Roles and Resilience,American Sociological Review,article,4,54,"Phyllis Moen; Donna Dempster-McClain; Robin M. Williams, Jr."
2008,Beyond the Census Tract: Patterns and Determinants of Racial Segregation at Multiple Geographic Scales,American Sociological Review,article,5,73,Barrett A. Lee; Glenn Firebaugh; Stephen A. Matthews; Sean F. Reardon; Chad R. Farrell; David O'Sullivan
2010,Gastronationalism: Food Traditions and Authenticity Politics in the European Union,American Sociological Review,article,3,75,Michaela DeSoucey
2001,The Wage Penalty for Motherhood,American Sociological Review,article,2,66,Michelle J. Budig; Paula England
2010,Cultural Foundations of Tokenism,American Sociological Review,article,6,75,Catherine J. Turco
2019,Performative State-Formation in the Early American Republic,American Sociological Review,article,2,84,Isaac Ariail Reed
1988,Divergence and Convergence in International Development: A Decomposition Analysis of Inequality in the World System,American Sociological Review,article,6,53,Walter Gillis Peacock; Greg A. Hoover; Charles D. Killian
1940,The Drug Addict as a Psychopath,American Sociological Review,article,6,5,A. R. Lindesmith
2014,Entrepreneurship as a Mobility Process,American Sociological Review,article,2,79,Jesper B. Sørensen; Amanda J. Sharkey
2018,Mass Mobilization and the Durability of New Democracies,American Sociological Review,article,2,83,Mohammad Ali Kadivar
2018,Precarious Sexuality,American Sociological Review,article,2,83,Trenton D. Mize; Bianca Manago
2018,"The Societalization of Social Problems: Church Pedophilia, Phone Hacking, and the Financial Crisis",American Sociological Review,article,6,83,Jeffrey C. Alexander
2012,Religion and Volunteering in Context,American Sociological Review,article,5,77,Carol Ann MacGregor; Chaeyoon Lim
2005,Unequal but Fluid: Social Mobility in Chile in Comparative Perspective,American Sociological Review,article,3,70,Florencia Torche
1996,Not for Widows Only: Institutional Politics and the Formative Years of Aid to Dependent Children,American Sociological Review,article,3,61,Nancy K. Cauthen; Edwin Amenta
1960,A Theory of Role Strain,American Sociological Review,article,4,25,William J. Goode
1980,"Bringing the Firms Back in: Stratification, Segmentation, and the Organization of Work",American Sociological Review,article,5,45,James N. Baron; William T. Bielby
1969,My Son the Doctor: Aspects of Mobility Among American Jews,American Sociological Review,article,3,34,Mariam K. Slater
2007,"Animal Practices, Ethnicity, and Community: The Turkish Pigeon Handlers of Berlin",American Sociological Review,article,6,72,Colin Jerolmack
2011,"Unions, Norms, and the Rise in U.S. Wage Inequality",American Sociological Review,article,4,76,Jake Rosenfeld; Bruce Western
2005,A Clash of Capitalisms: Foreign Shareholders and Corporate Restructuring in 1990s Japan,American Sociological Review,article,3,70,Christina L. Ahmadjian; Gregory E. Robbins
1990,"Explaining Military Coups D'État: Black Africa, 1957-1984",American Sociological Review,article,6,55,J. Craig Jenkins; Augustine J. Kposowa
1947,Book Notes,American Sociological Review,article,1,12,
1989,Evaluating the Evidence: Religious Economies and Sacred Canopies,American Sociological Review,article,6,54,Roger Finke; Rodney Stark
1989,Reply to O'Brien and Gwartney-Gibbs,American Sociological Review,article,3,54,William M. Mason; Joan R. Kahn
1976,Profit and Nonprofit Orientations and the Differentiations-Coordination Hypothesis for Organizations: A Study of Small General Hospitals,American Sociological Review,article,4,41,William A. Rushing
2018,Policy Entrepreneurs and the Origins of the Regulatory Welfare State: Child Labor Reform in Nineteenth-Century Europe,American Sociological Review,article,1,83,Elisabeth Anderson
2006,"Collective Action, Rival Incentives, and the Emergence of Antisocial Norms",American Sociological Review,article,2,71,James A. Kitts
2014,"Prenatal Exposure to Violence and Birth Weight in Mexico: Selectivity, Exposure, and Behavioral Responses",American Sociological Review,article,5,79,Florencia Torche; Andrés Villarreal
2018,The Social Sources of Geopolitical Power,American Sociological Review,article,6,83,Jonah Stuart Brundage
1999,Rebel without a Cause or Effect: Birth Order and Social Attitudes,American Sociological Review,article,2,64,Jeremy Freese; Brian Powell; Lala Carr Steelman
1988,Corporate Political Groupings: Does Ideology Unify Business Political Behavior?,American Sociological Review,article,2,53,Alan Neustadtl; Dan Clawson
2004,Reply to Zuckerman: Should Sociological Theories Venture into “Economic Territory?” Yes!,American Sociological Review,article,3,69,James D. Westphal; Edward J. Zajac
1996,Making Claims as Workers or Wives: The Distribution of Social Security Benefits,American Sociological Review,article,3,61,Madonna Harrington Meyer
2017,"Seeing Like the Fed: Culture, Cognition, and Framing in the Failure to Anticipate the Financial Crisis of 2008",American Sociological Review,article,5,82,Neil Fligstein; Jonah Stuart Brundage; Michael Schultz
2015,Tradition and Innovation in Scientists’ Research Strategies,American Sociological Review,article,5,80,Andrey Rzhetsky; James A. Evans; Jacob G. Foster
2010,Gastronationalism,American Sociological Review,article,3,75,Michaela DeSoucey
2008,The Colonial State as a Social Field: Ethnographic Capital and Native Policy in the German Overseas Empire before 1914,American Sociological Review,article,4,73,George Steinmetz
1951,Relationships Between Social Science and Child Guidance Practice,American Sociological Review,article,1,16,Otto Pollak
2019,Rhetorics of Radicalism,American Sociological Review,article,4,84,Daniel Karell; Michael Freedman
2006,Deterring Delinquents: A Rational Choice Model of Theft and Violence,American Sociological Review,article,1,71,Ross L. Matsueda; Derek A. Kreager; David Huizinga
1936,Early English Positivists and the Religion of Humanity,American Sociological Review,article,3,1,Gladys Bryson
1952,The Present Status of Social Theory: Discussion,American Sociological Review,article,2,17,Kenneth E. Bock
1991,"The Organization of Political Ideology: Culture, State, and Theater in Fascist Italy",American Sociological Review,article,5,56,Mabel Berezin
1975,Socioeconomic Status and Criminal Sentencing: An Empirical Assessment of a Conflict Proposition,American Sociological Review,article,6,40,Theodore G. Chiricos; Gordon P. Waldo
1980,Direct Government Involvement in the Economy: Theoretical and Empirical Extensions: Reply to Jackman and Firebaugh,American Sociological Review,article,1,45,Steven Stack
1996,"Concessions, Repression, and Political Protest in the Iranian Revolution",American Sociological Review,article,1,61,Karen Rasler
2006,"Comment on Somers and Block, ASR, April 2005: Free-Market and Religious Fundamentalists versus Poor Relief",American Sociological Review,article,3,71,Alexander Hicks
2010,"Threat, Resistance, and Collective Action",American Sociological Review,article,2,75,Thomas V. Maher
2009,Discrimination in a Low-Wage Labor Market: A Field Experiment,American Sociological Review,article,5,74,Devah Pager; Bart Bonikowski; Bruce Western
1983,"Issues of Theory, Issues of Fact",American Sociological Review,article,1,48,Kenneth A. Bollen; Burke D. Grandjean
2007,How Puerto Rico Became White: Boundary Dynamics and Intercensus Racial Reclassification,American Sociological Review,article,6,72,Jeronimo O. Muniz; Mara Loveman
1971,Student Unionism in the Netherlands: An Application of a Social Class Model,American Sociological Review,article,2,36,Cornelis J. Lammers
1986,Structure as Process: Organization and Role,American Sociological Review,article,5,51,Susan Lovegren Bosworth; Gary A. Kreps
2015,Working for Free in the VIP,American Sociological Review,article,6,80,Ashley Mears
1972,Role Differentiation,American Sociological Review,article,4,37,Gordon H. Lewis
2007,Climbing the Dispute Pagoda: Grievances and Appeals to the Official Justice System in Rural China,American Sociological Review,article,3,72,Ethan Michelson
1971,"The Religious Factor in Detroit: Review, Replication, and Reanalysis",American Sociological Review,article,1,36,Howard Schuman
1998,Strong Legacies and Weak Markets: Bulgarian State-Owned Enterprises During Early Transition,American Sociological Review,article,4,63,Kenneth I. Spenner; Olga O. Suhomlinova; Sten A. Thore; Kenneth C. Land; Derek C. Jones
2014,Racial Inequality Trends and the Intergenerational Persistence of Income and Family Structure,American Sociological Review,article,6,79,Deirdre Bloome
2016,Racial Capitalism and the Crisis of Black Masculinity,American Sociological Review,article,5,81,Jordanna Matlon
2012,Educational Differences in U.S. Adult Mortality: A Cohort Perspective,American Sociological Review,article,4,77,Ryan K. Masters; Robert A. Hummer; Daniel A. Powers
2017,The New Closed Shop? The Economic and Structural Effects of Occupational Licensure,American Sociological Review,article,3,82,Beth Redbird
2008,Mediation in Multiple Networks: Elite Mobilization before the English Civil War,American Sociological Review,article,3,73,Henning Hillmann
1998,Becoming a Gendered Body: Practices of Preschools,American Sociological Review,article,4,63,Karin A. Martin
2017,Why Should Women Get Less? Evidence on the Gender Pay Gap from Multifactorial Survey Experiments,American Sociological Review,article,1,82,Katrin Auspurg; Thomas Hinz; Carsten Sauer
2015,Tradition and Innovation in Scientists' Research Strategies,American Sociological Review,article,5,80,Jacob G. Foster; Andrey Rzhetsky; James A. Evans
2002,Two Decades of Family Change: The Shifting Economic Foundations of Marriage,American Sociological Review,article,1,67,Megan M. Sweeney
2006,"Care in Context: Men's Unpaid Work in 20 Countries, 1965-2003",American Sociological Review,article,4,71,Jennifer L. Hook
2006,"Collective Action, Rival Incentives, and the Emergence of Antisocial Norms",American Sociological Review,article,2,71,James A. Kitts
1985,"Same Time, Last Year: Selective Data Dredging for Negative Findings: Reply to Phillips and Bollen",American Sociological Review,article,3,50,James N. Baron; Peter C. Reiss
2011,"Protesting While Black? The Differential Policing of American Activism, 1960 to 1990",American Sociological Review,article,1,76,Christian Davenport; Sarah A. Soule; David A. Armstrong II
1992,"Historical Analogies, Generational Effects, and Attitudes Toward War",American Sociological Review,article,3,57,Howard Schuman; Cheryl Rieger
1995,"Engendering the Worlds of Labor: Women Workers, Labor Markets, and Production Politics in the South China Economic Miracle",American Sociological Review,article,3,60,Ching Kwan Lee
1973,The Assembling Process: A Theoretical and Empirical Examination,American Sociological Review,article,6,38,Clark McPhail; David Miller
2018,The Mark of a Woman’s Record: Gender and Academic Performance in Hiring,American Sociological Review,article,2,83,Natasha Quadlin
2016,The Privatization of Political Representation: Community-Based Organizations as Nonelected Neighborhood Representatives,American Sociological Review,article,6,81,Jeremy R. Levine
2009,The Politics of Union Decline: The Contingent Determinants of Union Recognition Elections and Victories,American Sociological Review,article,5,74,Daniel Tope; David Jacobs
2007,The Winds of Change: The Progressive Movement and the Bureaucratization of Thrift,American Sociological Review,article,1,72,Srikanth Paruchuri; Heather A. Haveman; Hayagreeva Rao
1952,The Present Status of Social Theory,American Sociological Review,article,2,17,Theodore Abel
2007,Does Money Whiten? Intergenerational Changes in Racial Classification in Brazil,American Sociological Review,article,6,72,Luisa Farah Schwartzman
2016,"Nonmarital First Births, Marriage, and Income Inequality",American Sociological Review,article,4,81,Andrew J. Cherlin; David C. Ribar; Suzumi Yasutake
2015,After State Socialism: The Political Origins of Transitional Recessions,American Sociological Review,article,2,80,Andrew G. Walder; Andrew Isaacson; Qinglian Lu
2011,How General Is Trust in “Most People”? Solving the Radius of Trust Problem,American Sociological Review,article,5,76,Kenneth Newton; Jan Delhey; Christian Welzel
2005,Cross-National Cultural Diffusion: The Global Spread of Cricket,American Sociological Review,article,1,70,Jason Kaufman; Orlando Patterson
2010,"Making the News: Movement Organizations, Media Attention, and the Public Agenda",American Sociological Review,article,6,75,Kenneth T. Andrews; Neal Caren
1965,Max Weber and Empirical Social Research,American Sociological Review,article,2,30,Paul F. Lazarsfeld; Anthony R. Oberschall
2003,No Evidence for Stochastic Learning in Voter Turnout,American Sociological Review,article,1,68,Steven P. Martin; Ching-Yi A. Shieh
1955,Toward the Development of a Short Form Test of Interpersonal Competence,American Sociological Review,article,6,20,Howard R. Stanton; Eugene Litwak
1994,Income Inequality and Industrial Development: Dualism Revisited,American Sociological Review,article,5,59,François Nielsen
2012,Revenge of the Managers,American Sociological Review,article,2,77,Adam Goldstein
2014,Coached for the Classroom: Parents' Cultural Transmission and Children's Reproduction of Educational Inequalities,American Sociological Review,article,5,79,Jessica McCrory Calarco
1964,Three Symposia on Political Behavior,American Sociological Review,article,5,29,Ralf Dahrendorf
1999,The Age-Period-Cohort Conundrum and Verbal Ability: Empirical Relationships and Their Interpretation: Reply to Glenn and to Alwin and McCammon,American Sociological Review,article,2,64,James A. Wilson; Walter R. Gove
1960,Sociology and Humane Learning,American Sociological Review,article,1,25,Robert Bierstedt
2017,Improving Cultural Analysis,American Sociological Review,article,1,82,Omar Lizardo
1981,Clarifying Confusions about Paradigms: A Reply to Ritzer,American Sociological Review,article,2,46,"Lester Hill, Jr; Douglas Lee Eckberg"
1955,Book Notes,American Sociological Review,article,4,20,
2006,The Growing Female Advantage in College Completion: The Role of Family Background and Academic Achievement,American Sociological Review,article,4,71,Claudia Buchmann; Thomas A. DiPrete
1994,"Does Economic Growth Benefit the Masses? Growth, Dependence, and Welfare in the Third World",American Sociological Review,article,5,59,Glenn Firebaugh; Frank D. Beck
1946,Sociological Principles and Occupied Germany,American Sociological Review,article,1,11,Clifford Kirkpatrick
1976,Community Power and Decision Making: A Replication and Extension of Hawley,American Sociological Review,article,4,41,Richard A. Smith
2018,Mass Mobilization and the Durability of New Democracies,American Sociological Review,article,2,83,Mohammad Ali Kadivar
1945,Is a Psychiatric Interpretation of the German Enigma Necessary?,American Sociological Review,article,4,10,Theodore Abel
2006,Cultural Assets or Structural Advantages in Numbers Gambling?,American Sociological Review,article,1,71,Jennifer Lee
2013,The Mechanics of Social Capital and Academic Performance in an Indian College,American Sociological Review,article,6,78,Sharique Hasan; Surendrakumar Bagde
1972,Household Complexity in Nineteenth Century France,American Sociological Review,article,2,37,"William L. Parish, Jr.; Moshe Schwartz"
2004,Growing Pains: Cross-National Variation in Sex Segregation in Sixteen Developing Countries,American Sociological Review,article,1,69,Mariko Lin Chang
1996,"The Effect of Changes in Intraracial Income Inequality and Educational Attainment on Changes in Arrest Rates for African Americans and Whites, 1957 to 1990",American Sociological Review,article,4,61,Gary LaFree; Kriss A. Drass
2015,The Price of Protection: A Trajectory Analysis of Civil Remedies for Abuse and Women's Earnings,American Sociological Review,article,1,80,Melanie M. Hughes; Lisa D. Brush
1990,Marxism as Science: Historical Challenges and Theoretical Growth,American Sociological Review,article,6,55,Michael Burawoy
2011,Cultural Anchors and the Organization of Differences: A Multi-method Analysis of LGBT Marches on Washington,American Sociological Review,article,2,76,Amin Ghaziani; Delia Baldassarri
2002,"Becoming a Pragmatist Philosopher: Status, Self-Concept, and Intellectual Choice",American Sociological Review,article,1,67,Neil Gross
2005,Cultural Politics and Modernist Architecture: The Tulip Debate in Postwar Hungary,American Sociological Review,article,1,70,Virág Molnár
2004,How Culture Mattered at Vatican II: Collegiality Trumps Authority in the Council's Social Movement Organizations,American Sociological Review,article,4,69,Melissa J. Wilde
2005,For Public Sociology,American Sociological Review,article,1,70,Michael Burawoy
2004,Revisiting the Contact Hypothesis: The Case of Public Exposure to Homelessness,American Sociological Review,article,1,69,Barrett A. Lee; Chad R. Farrell; Bruce G. Link
1943,Antagonistic Acculturation,American Sociological Review,article,2,8,George Devereux; Edwin M. Loeb
1947,The Role of the Guest: A Study in Child Development,American Sociological Review,article,2,12,James H. S. Bossard; Eleanor S. Boll
1973,"Comment on Williams' ""The Ecological Approach in Measuring Community Power Concentration""",American Sociological Review,article,3,38,Amos H. Hawley
2013,"The Association of Social Class and Lifestyles: Persistence in American Sociability, 1974 to 2010",American Sociological Review,article,4,78,Ivaylo D. Petev
2008,Agricultural Revolution and Elite Reproduction in Qing China: The Transition to Capitalism Debate Revisited,American Sociological Review,article,4,73,Ho-fung Hung
2018,A Systematic Assessment of “Axial Age” Proposals Using Global Comparative Historical Evidence,American Sociological Review,article,3,83,Daniel Austin Mullins; Daniel Hoyer; Christina Collins; Thomas Currie; Kevin Feeney; Pieter François; Patrick E. Savage; Harvey Whitehouse; Peter Turchin
2020,Workplace Compensation Practices and the Rise in Benefit Inequality,American Sociological Review,article,2,85,Tali Kristal; Edo Navot; Yinon Cohen
1988,"Inequality, Repression, and Violence: Issues of Theory and Research Design",American Sociological Review,article,5,53,Edward N. Muller
1951,The Labor Force as a Field of Interest for the Sociologist,American Sociological Review,article,4,16,Philip M. Hauser
1937,Chinese Family Life in America,American Sociological Review,article,5,2,Norman S. Hayner; Charles N. Reynolds
2004,Growing Pains: Cross-National Variation in Sex Segregation in Sixteen Developing Countries,American Sociological Review,article,1,69,Mariko Lin Chang
1991,"Conflict and Historical Variation in Steel Capital-State Relations: The Emergence of State Structures and a More Prominent, Less Autonomous State",American Sociological Review,article,5,56,Harland Prechel
1985,The Public Economy and Economic Growth in Western Market Economies,American Sociological Review,article,4,50,Roger Friedland; Jimy Sanders
1971,Professional Self-Images and Political Perspectives in the Greek Military,American Sociological Review,article,6,36,George Andrew Kourvetaris
2007,"Adoptive Parents, Adaptive Parents: Evaluating the Importance of Biological Ties for Parental Investment",American Sociological Review,article,1,72,Laura Hamilton; Simon Cheng; Brian Powell
1940,Trends in the Soviet Treatment of Crime,American Sociological Review,article,4,5,John N. Hazard
2003,"""Secularization"" by Any Other Name",American Sociological Review,article,2,68,Gerald Marwell; N. J. Demerath III
1963,The Changing Foundations of the Parsonian Action Scheme,American Sociological Review,article,5,28,John Finley Scott
1996,Ending Footbinding and Infibulation: A Convention Account,American Sociological Review,article,6,61,Gerry Mackie
1944,Russian Values and Character--A Preliminary Exploration,American Sociological Review,article,3,9,Joseph K. Folsom; Nikander Strelsky
1973,Reply to Burke,American Sociological Review,article,6,38,Gordon H. Lewis
2011,Variance Function Regression in Hierarchical Age-Period-Cohort Models: Applications to the Study of Self-Reported Health,American Sociological Review,article,6,76,Hui Zheng; Yang Yang; Kenneth C. Land
2011,"Unions, Norms, and the Rise in U.S. Wage Inequality",American Sociological Review,article,4,76,Bruce Western; Jake Rosenfeld
2007,Not by Productivity Alone: How Visibility and Specialization Contribute to Academic Earnings,American Sociological Review,article,4,72,Erin Leahey
2006,"Networks, Race, and Hiring",American Sociological Review,article,1,71,Roberto M. Fernandez; Isabel Fernandez-Mateo
1983,Mental Health and the Interpersonal Environment: A Reexamination of Some Effects of Social Structure on Mental Health,American Sociological Review,article,2,48,Charles Kadushin
1982,Cultural Capital and School Success: The Impact of Status Culture Participation on the Grades of U.S. High School Students,American Sociological Review,article,2,47,Paul DiMaggio
1992,The Log-Multiplicative Layer Effect Model for Comparing Mobility Tables,American Sociological Review,article,3,57,Yu Xie
1999,Collective Violence and Group Solidarity: Evidence from a Feuding Society,American Sociological Review,article,3,64,Roger V. Gould
2007,"Working More and Feeling Better: Women's Health, Employment, and Family Life, 1974-2004",American Sociological Review,article,2,72,Jason Schnittker
1978,A Cross-Cultural Study of Expressive and Instrumental Role Complementarity in the Family,American Sociological Review,article,4,43,William D. Crano; Joel Aronoff
2019,Hearing Gender,American Sociological Review,article,5,84,Danya Lagos
1998,Assessing the Oppositional Culture Explanation for Racial/Ethnic Differences in School Performance,American Sociological Review,article,4,63,James W. Ainsworth-Darnell; Douglas B. Downey
1970,Marxist Dialectic and Pragmatism: Power as Knowledge,American Sociological Review,article,2,35,Joan Huber Rytina; Charles P. Loomis
2011,Variance Function Regression in Hierarchical Age-Period-Cohort Models,American Sociological Review,article,6,76,Kenneth C. Land; Yang Yang; Hui Zheng
1988,"Democracy, Economic Development, and Income Inequality",American Sociological Review,article,1,53,Edward N. Muller
2002,How the Civil Rights Movement Revitalized Labor Militancy,American Sociological Review,article,5,67,Larry Isaac; Lars Christiansen
2014,"Union Strength, Neoliberalism, and Inequality: Contingent Political Analyses of U.S. Income Differences since 1950",American Sociological Review,article,4,79,Lindsey Myers; David Jacobs
2008,Mediation in Multiple Networks: Elite Mobilization before the English Civil War,American Sociological Review,article,3,73,Henning Hillmann
2008,Religion and the Construction of Civic Identity,American Sociological Review,article,1,73,Paul Lichterman
2019,"Linked Lives, Linked Trajectories: Intergenerational Association of Intragenerational Income Mobility",American Sociological Review,article,6,84,Siwei Cheng; Xi Song
1967,Toward a Sociological Model of Consensus,American Sociological Review,article,1,32,Thomas J. Scheff
1989,Generations and Collective Memories,American Sociological Review,article,3,54,Howard Schuman; Jacqueline Scott
2019,Mapping Cultural Schemas: From Theory to Method,American Sociological Review,article,5,84,Lauren Valentino; M.B. Fallin Hunzaker
1951,Sociological Research in the Field of Medicine: Progress and Prospects,American Sociological Review,article,5,16,Oswald Hall
1951,The Concept of Jewish Culture and the State of Israel,American Sociological Review,article,4,16,Henrik F. Infield
2014,Prisoners and Paupers: The Impact of Group Threat on Incarceration in Nineteenth-Century U.S. Cities,American Sociological Review,article,3,79,Susan Olzak; Suzanne Shanahan
